Job Profile,Job Description,Company Name,Company Link,Job Link,Easy Apply
Senior Software Developer,"About the job
Job Description

Role Description

This Role Has Been Created To

Serve the needs of intermediate developers in the Analyst Developer job family and specifically delivering with the low-code FNZ Studio platform
Provide developers with a basis for developing the business, technical and professional skills required to be an effective developer at FNZ.
Provide a launching pad for transition into Senior Analyst Developer roles.
Support delivery obligations to customers and internal stakeholders.

Specific Role Responsibilities

Analysis & Design 

Collaborate with analyst tester and developer colleagues to create user story definitions and acceptance criteria.
Work within the constraints of the feature/user story to define the underlying detail of required changes.
Collaborate with analyst testers and solution consultants to ensure the solution well-defined and fit-for-purpose. It must meet end-to-end requirements are work well. This requires learning underlying business processes and understanding the technical environment in which you are operating.
Provide solutions and recommendations for the resolution of technical issues that arise and ensure solutions meet the technical specs and design requirements; 
Be a part of designing APIs and external system interfaces for integration into core FNZ products and third-party vendor applications.

Development 

interpret complex financial business requirements and translate into high transactional, high-availability, secure, working systems
Design and build the highly intuitive user interface and interactive financial tools required by financial advisers and investors.
Non-functional requirements: Consider non-functional requirements. We produce high-volume, real-time transaction processing systems that support millions of trades every day in investment securities in multiple world markets. You will work with other developers to make sure that solutions developed are secure, reusable, maintainable and performant.
Collaborate with other developers to make sure that the solutions developed are robust and in-line with the requirements.
Ensure code is designed and built in a reusable manner. 
Able to build medium complexity features end-end. 
Continually develop an understanding of the business functionality of FNZ platforms

Quality 

Participate in code reviews to gain feedback on your technique from senior peers and to give advice to junior peers. Review senior developers' code to enhance your skills and knowledge. 
Write automated unit tests for any newly created code; and 
Perform manual testing to ensure any changes made to the system are of a high standard and the system hasn’t regressed.

Collaboration / Communication 

Engage in the collaboration and communication channels in the organization. Participate in solution design to ensure that creative solutions and tough problems solved are called out appropriately to the developer community, and where they lead to visible outcomes, to the broader FNZ teams and clients. 
Collaborate with other developers to share knowledge, best practices, useful technology, and opportunities for cross-project system design / solutions. 
Mentor new starters to ensure they understand both platform and SDLC. 
Deliver knowledge-sharing sessions on topics of your personal expertise.

Technology 

Stay up to date with industry practices, new technologies, tools and methods and suggestion adoption that are best suited to FNZ. 
Proactively resolve technical (environmental, coding and testing) issues that impede development progress. Assist in the resolution of technical issues when requested.
Create novel solutions to problems by incorporating cutting edge technology or generic concepts.

Functional Area Responsibilities

Analyst Developers at FNZ are all-rounders who can work across the full stack. This role involves working with complex business requirements in a wide range of functional areas in the financial services and platform domain.

In this role, you are responsible for continued learning both in the FNZ business domain and your technical skills as a professional software engineer. You achieve this growth through hands-on work, training and interaction with your senior colleagues.

Analyst Developers own non-functional requirements and are responsible for ensuring that their code complies with coding standards, is secure and performs well. At entry-level, you are responsible for learning best-practice in these areas from your senior peers.

Experience Required

Primary requirements

5+ years of experience as Software Developer (in Java is preferred)
Bachelor’s degree in computer science, Information Technology, or a related field.
Proven experience in low-code development platforms.
Confident, and able to take initiative in a delivery-focused environment.
Independent, self-directed working style.
Ability to learn quickly in a dynamic fast-paced industry.
Enjoy working as part of a high-performance team.
Hard-working, innovative and takes pride in their work; and
Passionate about creating innovative solutions for customers.

Secondary Requirements

Experience in one enterprise software architecture project, where scalability, security, and data integrity topics were relevant concerns
Experience in developing for at least one three-tier Web Application, and a good understanding of the technologies belonging to all three tiers
Capable of discerning the relevant characteristics of an architecture given limited information, zooming in on specific topics which need to be promptly tackled, but without losing the big picture, with the clear goal of integrating most safely and smoothly with the customer's environment
Understanding of Web Application frontend technologies, including JavaScript and HTML
Demonstrable experience with various integration protocols, including different kinds of Web Service frameworks

About FNZ Culture

Our culture is what drives us. It's at the heart of who we are and everything we do. It's what inspires, excites and moves us forward. Our ambition is to create a culture for growth, one that opens up limitless opportunities for our employees, customers and the wider world. At FNZ we know that great impact is only possible with great teamwork.

That’s why we value the strength and diversity of thought in our global team.

The FNZ Way is the cornerstone of what we do. It is comprised of four values that set the standard for how everyone at FNZ interacts with each other, with our customers, and with all our diverse stakeholders around the world.

Customer obsessed for the long-term Think big and make an impact Act now and own it all the way Challenge, commit and win together

Read more about The FNZ Way and our values: www.fnz.com/culture

Opportunities

Right from day one, you will work alongside exceptional, multicultural teams - experts in their respective fields - who will inspire and challenge you to make your greatest impact. 
Be part of a highly successful, rapidly growing, global business that is leading the delivery of financial services via cloud computing and partners with some of the world’s largest companies. 
Working in a flexible and agile way that meets the needs of the business and personal circumstances. 
Remuneration, significant financial rewards and career advancement is based on individual contribution and business impact rather than tenure or seniority. 
We provide global career opportunities for our best employees at any of our offices in the UK, EU, US, Canada, South Africa and APAC. 

Commitment to Equal Opportunities 

At FNZ, we recognize that diversity, equity and inclusion are important factors contributing to our success. We embrace the unique perspective and capabilities of our current and future employees, which will help us continue to drive innovation and achieve our business goals. Recruitment decisions at FNZ are made in a nondiscriminatory manner without regard to gender, ethnicity/race, faith, age, nationality, gender identity, sexual orientation, marital status, socio-economic background, disability or military veteran status where all applicants and employees are valued and respected.

In addition, we want to ensure accessibility needs are well supported, if you require specific support please advise us.

About FNZ

FNZ is committed to opening up wealth so that everyone, everywhere can invest in their future on their terms. We know the foundation to do that already exists in the wealth management industry, but complexity holds firms back. 

We created wealth’s growth platform to help. We provide a global, end-to-end wealth management platform that integrates modern technology with business and investment operations. All in a regulated financial institution. 

We partner with over 650 financial institutions and 12,000 wealth managers, with US$1.5 trillion in assets under administration (AUA).

Together with our customers, we help over 20 million people from all wealth segments to invest in their future.",FNZ,https://www.linkedin.com/company/fnz/life,https://www.linkedin.com/jobs/view/4092803966/?eBP=CwEAAAGXnoo6yQF_K_SjJ2WCp8A1YtRFqL4WzYaDWK45JPskUcMl1sHdt7Bu0mz6REl0zqozQ0wbGfT6OHCCSTxsf6g1jalyP0nE4_HguNf26hzoeIx_oV5nafTVubAPvj4p0997koA_I3j7AXMJGoYepaSkxUxR3LiLGS71JnNlyb-R4rO8lN83O9C5_Qg92-EzCQccoLlbQHoer0xxu66oGzp1EdrA_JwNXLlg01e4XtGfFbVbXtfIsF1-ShvaJy5jn6FlqbPdj9BK6_PasX_7Ligfg81e_SOOsW_BuMwG3O7wcQRjTJmnArDZdGtf_RjrCXoVK56LtIwz1K1FVoirqgfU1oOrNsP_72y1MGSGiG_s18xgk4Ombj-nuv2evSlB5S0HT_xvvqKYja4f7AKYNLkFcTj1ndPpAdL8fosLKhu0ZYlX0P7AvIchlpcGg1KjOpV8VFIRvRk&refId=XJA2PO6f9coZctC%2F3dKjKA%3D%3D&trackingId=%2FcYVMQ3PHv5vjTTFNzdmyw%3D%3D&trk=flagship3_jobs_discovery_jymbii,No
Backend Engineer,"About the job
Experience: 1.00 + years

Salary: INR 800000-1500000 / year (based on experience)

Expected Notice Period: 30 Days

Shift: (GMT+05:30) Asia/Kolkata (IST)

Opportunity Type: Remote

Placement Type: Full Time Permanent position(Payroll and Compliance to be managed by: Leegality)

(*Note: This is a requirement for one of Uplers' client - Leegality)

What do you need for this opportunity?

Must have skills required:

AWS, Python, Django, MongoDB, Redis, Flask

Leegality is Looking for:

Requirements

Job Brief:

As a Backend Engineer, you will develop solutions to interesting technical problems, explore exciting growth opportunities, and have a real impact on our product.
For this, you need to be strong in development processes and methods, and a deep knowledge of application, database, and security are required. A basic understanding of front-end technologies is good to have.


Responsibilities:

Your core objectives are to take conceptual ideas and design and deliver highly scalable, multi-tiered web services while constantly working to better your craft.
We truly value people who are self-directed and can work independently as well as across teams to solve technical roadblocks for our customers.
You should apply if you can write clean and highly maintainable code. The ability to leave code in a better position than you found is always good to have.
You will be working with an agile and cross-functional team that is constantly pushing each other to solve production issues and improve the operational efficiency of the platform.
You need excellent communication skills to discuss and explain technical concepts internally with the engineering, operation teams.
Basic understanding of front-end technologies is good to have.
Assess and prioritize feature requests
Coordinate with internal teams to understand user requirements and provide technical solutions.


Requirements:

Programming Language: Python 
Framework: Django, Flask
Database: MySQL, MongoDB
Cloud: AWS
Must: TDD (Test Driven Development), exposure to CI/CD, exposure to microservices. 
Experience with end-to-end solution development, deployment, and maintenance
1-6 years of hands-on experience with Python web services and an understanding of SAAS, REST/OAuth/JSON architectures and services.
Experience in developing extensible APIs and highly maintainable services.
Good communication skills


Preferences:

Start-up experience is a must
Willing to join immediately, ideally.


Interview Process :

Technical Round 1 - Python basics + DSA Problem 
Technical Round -2 Advanced Python + LLD 
Technical Round 3 -Advanced Python + HLD
Offer dicussuon -F2F in Delhi office


How to apply for this opportunity?

Step 1: Click On Apply! And Register or Login on our portal.
Step 2: Complete the Screening Form & Upload updated Resume
Step 3: Increase your chances to get shortlisted & meet the client for the Interview!


About Uplers:

Our goal is to make hiring reliable, simple, and fast. Our role will be to help all our talents find and apply for relevant contractual onsite opportunities and progress in their career. We will support any grievances or challenges you may face during the engagement.

(Note: There are many more opportunities apart from this on the portal. Depending on the assessments you clear, you can apply for them as well).

So, if you are ready for a new challenge, a great work environment, and an opportunity to take your career to the next level, don't hesitate to apply today. We are waiting for you!

Desired Skills and Experience
AWS, Python, Django, MongoDB, Redis, Flask",Uplers,https://www.linkedin.com/company/weareuplers/life,https://www.linkedin.com/jobs/view/4244487559/?eBP=CwEAAAGXnooEAFBNRfy3jjbQkCD0sKZB1pVgNakfioKaDU6UT4fAS8ZRGS7U4EbYP5WaBKX8ebh7ZQOxf0F7y6hMMtGmgcUsN5hdNJJKUSaXyzWa9natxgqPSjfC4t1d4buzPyPkLw-5QmSYgK6Vds11098tWq0Tg-g00kA07OFcUzBKl1uhUknE-FgmM6q_Om0-t4QjOWIxp6dVyvHRxCfwszbGmGJfkoe6GAxtCTsJbjiNGqmop6dst1PO4ioUR-bfKLBZ2BwZGifyXfP7jv4K-i31sWVB0FNRocwsZy4bDHVoxgekJODrgb1TXAoHPbA8sEtDHNpQQiqGFyKdRG2k8dU6Npn1KRAaqZ-UJUYJYxJ9nFRZJxwglh-HXnLZo_EfMxQ8_VIe5TMCtpupME-v2Oskl1bqyOoT_fFyndoh6UwE5LvbfGrJJqeduAeADoOFoaCcvg4Y&refId=eIk76E2HETm%2FFIq4vh7i9A%3D%3D&trackingId=TCOtn3PwjVkIUBH%2B4BCxhQ%3D%3D&trk=flagship3_jobs_discovery_jymbii,No
Engineer I,"About the job

At American Express, our culture is built on a 175-year history of innovation, shared values and Leadership Behaviors, and an unwavering commitment to back our customers, communities, and colleagues. As part of Team Amex, you'll experience this powerful backing with comprehensive support for your holistic well-being and many opportunities to learn new skills, develop as a leader, and grow your career.

Here, your voice and ideas matter, your work makes an impact, and together, you will help us define the future of American Express.

How will you make an impact in this role?
There are hundreds of opportunities to make your mark on technology and life at American Express. Here’s just some of what you’ll be doing:
Contributes to design, development, troubleshooting, debugging, evaluating, modifying, deploying and documenting software and systems that meet the needs of Oracle Cloud application
Design, development, troubleshooting, support and debugging of software development in Oracle cloud.

Building File-based and API based integration between systems using secure the transmission. 

Designing Micro Services & integration patterns to securely communicate with backend services and clients.

Function as member of an Agile team by contributing to software builds through consistent development practices.

Participate in code reviews.

Quickly debug basic software components and identify code defects for remediation.

Enable the deployment, support, and monitoring of software across test, integration, and production environments.

Ensures timely completion and quality product, including documentation and other deliverables produced by engineering team.

Identifies opportunities to adopt innovative & new technologies to solve existing business needs and predict future challenges.

Must have experience collaborating with Product Owners on business process enhancements.
Provide constructive input and perspective to team conversations and effectively facilitate/negotiate through challenging situations.

Minimum Qualifications
· Bachelor’s Degree in CS or CSE or Equivalent.
· 6-10 years technical expertise in implementing Oracle cloud in a Global organisations structure and knowledge on Oracle E-Business is preferred 

· Hands-on experience in the design and development in Oracle cloud pertaining to Oracle Financials -Procure to Pay (Payables, Fixed Assets, Projects and Payments). 
Hands-on experience in developing BI Reports, Interfaces, Conversions .
· Hand on experience in building integration/interfaces based on web services (SOAP and REST using JSON, XML), File based interfaces (Batch Processing), Database (SQL and PLSQL).
· Strong technical experience in Fusion Finance and SCM BIP, OTBI, FRS and Smartview reporting mechanisms. BICC knowledge will be add-on.
· Conversion related to invoices, Purchase orders, Assets and Projects using the FBDI , ADFDI and UCM
· Hands-on experience Security concepts like - API Security, Encryptions, Vault and Masking
· Should be aware of customisation process in ERP Cloud: Sandboxes, Page Integrations, Application and Page Composer. VBCS/APEX good to have
· Experience with web services, open API development and its concepts.



Preferred Qualifications
Technical knowledge of Oracle Development tools - PL/SQL, OAF, reports, Oracle workflow and Profound knowledge on oracle database
Functional knowledge in finance/ procure to pay domain
Knowledge of Collaboration Tools (GitHub, Confluence, Rally).

Experience in Continuous Integration and Deployment (Jenkins).

Oracle Financials including Procure to Pay, Fixed Assets, Projects or General Ledger.

Agile/SAFe practices in building software
We back you with benefits that support your holistic well-being so you can be and deliver your best. This means caring for you and your loved ones' physical, financial, and mental health, as well as providing the flexibility you need to thrive personally and professionally:
Competitive base salaries 
Bonus incentives 
Support for financial-well-being and retirement 
Comprehensive medical, dental, vision, life insurance, and disability benefits (depending on location) 
Flexible working model with hybrid, onsite or virtual arrangements depending on role and business need 
Generous paid parental leave policies (depending on your location) 
Free access to global on-site wellness centers staffed with nurses and doctors (depending on location) 
Free and confidential counseling support through our Healthy Minds program 
Career development and training opportunities
American Express is an equal opportunity employer and makes employment decisions without regard to race, color, religion, sex, sexual orientation, gender identity, national origin, veteran status, disability status, age, or any other status protected by law. 

Offer of employment with American Express is conditioned upon the successful completion of a background verification check, subject to applicable laws and regulations.",American Express,https://www.linkedin.com/company/american-express/life,https://www.linkedin.com/jobs/view/4249771824/?eBP=CwEAAAGXnon8akY05ucKJkDt7WRu2r4B5FNEIVVLMQDdg_IKT3cJEi6nrCM7HHb-kZdtduI4KgBtMPE1480lilVELr6-1XmhpnSVYS8pCIRUWkkRwdtT8JV0MjPblATSOAxe5Mf-DzWzvYf4R-WFyEzDIDUcdULUkMBlgQ1nWuUzVO9JD23co_rQa106anesXZi1nhdo6rYy8qnWQoAXziij2smEZUyJbl8Uti6JgAc1VG-9XPdOqbruhYk_rgJ2KlrnDybZodUMCKf9JzcdX3uCLtFdRsuHTu2KLqxG7u1ahAtsFDFfHZSuvStPBTbHWQbMxVGvKPh_HCgsieZp_0t0ngtOOJwOVcae63NukAXEn06TqsOAbiGi9ZokNgN_9HxuU7-ajfW4rpxQmwQJhG84GbSZ7V9PYS8RBRvRIzA9rOpGieYKoWtqPB0XULwr2IzLYtL9GoWj&refId=TDn6WGgkyp79raMhcg9hJg%3D%3D&trackingId=mERQJwHbkGlZiRTCB%2BxLJQ%3D%3D&trk=flagship3_jobs_discovery_jymbii,No
