Job Profile,Job Description,Company Name,Company Link,Job Link,Easy Apply
Software Engineer,"About the job
Vencora Business Unit

Job Summary:

We are growing our Gurgaon office for Software Engineers who can contribute to the programming innovative solutions which will include projects across a variety of solutions in Digital, SaaS/PaaS, DevOps and Cloud in a global team. You will get involved in testing, module development in current and new environments, contribute to development processes, procedures and leading with examples and ideas. As a Software Engineer you will be working with systems that deal with millions of insurance quotes a day and so, by using your knowledge and experience of software engineering, you will help the team continue to provide market leading solutions to our customers.

Job Description

WE’D LIKE TO MEET A SOFTWARE DEVELOPER WITH:

Microsoft .NET experience with customer driven approach
Ability to work in a global team who can bring innovative ideas
Take business requirements and ideas into complete solutions
Work with Business Analysts, Project Managers, Testers, Support and external customers
Application support and problem investigation to releasing fixes
Code reviews, testing, performance tuning, analysis and quality standards
Work in Agile and SDLC

The Software Developer Responsibilities Include

Applies data analysis, data modelling, and quality assurance techniques, based upon a detailed understanding of business processes, to establish, modify or maintain data structures and associated components (entity descriptions, relationship descriptions, attribute definitions). Advises database designers and other application development team members on the details of data structures and associated components
Specifies user/system interfaces, and translates logical designs into physical designs taking account of target environment, performance requirements and existing systems. Produces detailed designs and documents all work using required standards, methods and tools, including prototyping tools where appropriate
Designs, codes, tests, corrects, and documents moderately complex programs and program modifications from supplied specifications, using agreed standards and tools. Conducts reviews of supplied specifications, with others as appropriate
Identifies and resolves issues with applications, following agreed procedures. Uses application management software and tools to collect agreed performance statistics. Carries out agreed applications maintenance tasks
Develops a broad understanding of technical publication concepts, tools and methods and the way in which these are implemented. Develops an understanding of development support activities, such as information gathering, user task analysis, creating draft documentation, and illustration, and printing and publishing. Works with colleagues and clients to create new sections of technical documentation through all stages of the publication process as support literature
Defines the integration build and produces a build definition for generation of the software. Accepts software modules from software developers, and produces software builds for loading onto the target hardware from software source code. Configures the hardware environment, produces integration test specifications, conducts tests and records the details of any failures. Carries out and reports fault diagnosis relating to moderately complex problems

TECHNICAL SKILLS You Will Be Working With

VB.net, C# .NET 4 or higher
ASP.NET (4.5), jQuery, Bootstrap, WCF, Web API and Services
TDD or SOLID principles
Unit Testing
SQL Server
AWS working experience is preferable.

Worker Type

Regular

Number Of Openings Available

1",Vencora,https://www.linkedin.com/company/vencoragroup/life,https://www.linkedin.com/jobs/view/4102248980/?eBP=NOT_ELIGIBLE_FOR_CHARGING&refId=eIk76E2HETm%2FFIq4vh7i9A%3D%3D&trackingId=0BvRJ0nzNB9s4zYSIhc7cg%3D%3D&trk=flagship3_jobs_discovery_jymbii,No
App Dev Engineer II- Varicent ICM,"About the job
About NCR VOYIX

NCR VOYIX Corporation (NYSE: VYX) is a leading global provider of digital commerce solutions for the retail, restaurant and banking industries. NCR VOYIX is headquartered in Atlanta, Georgia, with approximately 16,000 employees in 35 countries across the globe. For nearly 140 years, we have been the global leader in consumer transaction technologies, turning everyday consumer interactions into meaningful moments. Today, NCR VOYIX transforms the stores, restaurants and digital banking experiences with cloud-based, platform-led SaaS and services capabilities.

Not only are we the leader in the market segments we serve and the technology we deliver, but we create exceptional consumer experiences in partnership with the world’s leading retailers, restaurants and financial institutions. We leverage our expertise, R&D capabilities and unique platform to help navigate, simplify and run our customers’ technology systems.

Our customers are at the center of everything we do. Our mission is to enable stores, restaurants and financial institutions to exceed their goals – from customer satisfaction to revenue growth, to operational excellence, to reduced costs and profit growth. Our solutions empower our customers to succeed in today’s competitive landscape.

Our unique perspective brings innovative, industry-leading tech to all the moving parts of business across industries. NCR VOYIX has earned the trust of businesses large and small — from the best-known brands around the world to your local favorite around the corner.

This position is responsible for supporting Sales Compensation application. The candidate will be required to team with business and IT associates to support the application. They work closely with BAs, Architects and other stakeholders to define root cause analysis and provide integrated solutions based upon customized computer architecture and applications. They apply their expertise to improve business processes and support critical business strategies, as they seek out opportunities to educate customers in the strategic use of technology.

Candidate should have knowledge on sales incentives, compensation plans, plan to pay cycle, commissions, Draw, accelerator and Quota/Target

Requirements:

 2 + years IT Experience
 Sales Incentive Compensation Management (SPM) business processes knowledge
 Configure Varicent ICM software applications
 Design, implement and maintain the Varicent model
 Build reports Varicent for incentive compensation business metrics
 Update the Varicent model for changes in compensation plans
 Work with the HR, Finance and Sales Operations teams to ensure smooth communication
 Very good knowledge of SQL and relational database concepts
 Audit / Validate incentive compensation plans and rules reflected in payout calculations
 Assist with monthly payout processing
 Assist with all aspects of incentive compensation technology
 Excellent communication and presentation skills
 Strong problem-solving and creative thinking
 Experience in defining, leading and executing IT testing plans
 Lead virtual project teams
 Experience in Software project development lifecycle (Agile, Iterative, Waterfall)
 Ability to create quick solution concepts, prototypes to visualize solution being proposed
 Bachelor's Degree in Computer Science /MCA

Preferred:

 Varicent ICM experience

Offers of employment are conditional upon passage of screening criteria applicable to the job

EEO Statement

Integrated into our shared values is NCR Voyix’s commitment to diversity and equal employment opportunity. All qualified applicants will receive consideration for employment without regard to sex, age, race, color, creed, religion, national origin, disability, sexual orientation, gender identity, veteran status, military service, genetic information, or any other characteristic or conduct protected by law. NCR Voyix is committed to being a globally inclusive company where all people are treated fairly, recognized for their individuality, promoted based on performance and encouraged to strive to reach their full potential. We believe in understanding and respecting differences among all people. Every individual at NCR Voyix has an ongoing responsibility to respect and support a globally diverse environment.

Statement to Third Party Agencies

To ALL recruitment agencies: NCR Voyix only accepts resumes from agencies on the preferred supplier list. Please do not forward resumes to our applicant tracking system, NCR Voyix employees, or any NCR Voyix facility. NCR Voyix is not responsible for any fees or charges associated with unsolicited resumes

“When applying for a job, please make sure to only open emails that you will receive during your application process that come from a @ncrvoyix.com email domain.”",NCR Voyix,https://www.linkedin.com/company/ncrvoyix/life,https://www.linkedin.com/jobs/view/4194033258/?eBP=CwEAAAGXnoo6ya0WcHXU7TphpWXK-Vg_eIQ_17AspHaF7ymfoSrGyZSeCpmOZ6_Y6fwfUARjEeZ8qUdkcI64TsFDM6pS5us-OzeKw9UrShUb8-4LScOuMH0VQ4LvYEffKvZxMENCCltGsByp5a95ZdU5BmBetKF9xscvVw1pVWM4Q21Nnn4QPJRmWBwuFJnqx7y7DPoLNoe5vs2epAzSv4p8jvnxtbxMubrcNGdj94Ui29yJdQP-AEOxnX2DxEyWYzfIEeWrvSSbpUIM_9DZEN2EVMloKBrY9Vk21rFra0TsvumicBYlokBVtZbFD5sXNhgWkOAXjF6FppwAB8ve2HAjPczmYt7bzrWcC5svfRLj65xPRyhmHy4XDwsdGaF5VndmlZeAydfCxdQlR9QFSm_euNBWJRXMsYqHWWeqd0IZFvKRX8BgMIhGAutQYclAmq8Glqn0iQ4JJI0&refId=XJA2PO6f9coZctC%2F3dKjKA%3D%3D&trackingId=oPLNHgEmV7tv1dSUwVnSNA%3D%3D&trk=flagship3_jobs_discovery_jymbii,No
N/A,N/A,Oracle,N/A,https://www.linkedin.com/jobs/view/4253324014/?eBP=CwEAAAGXnon8afhKouOGz7YUIHlTBb5EZhmHC6Wqi-VQsV225iluZBNZTBGsXU3D2PW95XrHCVgZqprMw5iawxSfCHhif6Xif0QmFetOrJFN5utZgeCS3DLtnWBq_2I3zeKZacVXpMxcIUBQK8UP-nMeZS8EhRNcqbFZvgaID8MpT_eZYJbE2UAoOwaY5FaPL3IQmFzFypCTRkoUG1KkMmEIviYr-gYtLkoloF8aTxsIqnaUpunhlib7TjKKeyxAy-Xw5FoXGylrHD8PA8UOyTGdFFRvRBZMuQUtzdxP0QcjSHi0KBjndi2Q214d5ufRysQ2AUN7HzR0PnyhaNMzffenKGRiz7XYJfhgSswNBDwhNa8lHy3eUUV8X8sWkm05wJo_3L2PJgtCauiHxOM51fqT0ZQZU5DJfQDK1rZpPWv7lyN4oZ-OHI7rLZwgSnLLrnArx_y7_4KkryiKpMbtCc1HktfQ_nYIYCeYtYTee_HTsD0&refId=TDn6WGgkyp79raMhcg9hJg%3D%3D&trackingId=4b26zbIC8W42H9ZyCFWPXA%3D%3D&trk=flagship3_jobs_discovery_jymbii,No
SQL Developer (Broking/Trading Domain),"About the job
Job Summary:
We are looking for a detail-oriented and data-savvy Database Analyst / SQL Developer with hands-on experience in Oracle and SQL Server. The ideal candidate should have a strong understanding of database structures and be proficient in writing and optimizing SQL queries, procedures, and scheduled jobs. A good grasp of data relationships and query logic is essential.


Key Responsibilities:
Develop, test, and maintain SQL queries, stored procedures, functions, and views in Oracle and SQL Server.
Read from and write to database tables for business logic processing and reporting.
Design and optimize joins, subqueries, and complex data retrieval logic.
Analyze existing database structures and recommend optimizations.
Support data quality and integrity across systems.
Create and maintain scheduled jobs, ETL processes, or data pipelines.
Work with application developers to support backend data needs.
Troubleshoot database issues and performance bottlenecks.


Required Skills:
Proficiency in Oracle PL/SQL and T-SQL (SQL Server).
Strong knowledge of joins, subqueries, and data manipulation.
Ability to understand and work with stored procedures, functions, triggers, and scheduled jobs.
Experience in reading and interpreting relational database models.
Understanding of indexes, constraints, and basic normalization.
Familiarity with data profiling and basic data modeling concepts.


Preferred:
Knowledge of data migration, ETL tools, or SSIS/Oracle Data Integrator.
Familiarity with cloud databases (e.g., Azure SQL, Oracle Cloud).
Experience with reporting tools or writing queries for dashboards.


Soft Skills:
Strong analytical and problem-solving mindset.
Ability to communicate effectively with business and technical teams.
Self-motivated and able to work independently or in a team.",SMC Group,https://www.linkedin.com/company/smc-group/life,https://www.linkedin.com/jobs/view/4252913247/?eBP=BUDGET_EXHAUSTED_JOB&refId=eIk76E2HETm%2FFIq4vh7i9A%3D%3D&trackingId=255qLxgAPm2eJ3JfMNSNfw%3D%3D&trk=flagship3_jobs_discovery_jymbii,Yes
Python Fullstack Engineer - Remote Work,"About the job
At BairesDev®, we've been leading the way in technology projects for over 15 years. We deliver cutting-edge solutions to giants like Google and the most innovative startups in Silicon Valley.

Our diverse 4,000+ team, composed of the world's Top 1% of tech talent, works remotely on roles that drive significant impact worldwide.

When you apply for this position, you're taking the first step in a process that goes beyond the ordinary. We aim to align your passions and skills with our vacancies, setting you on a path to exceptional career development and success.

Python Fullstack Engineer at BairesDev

We are seeking a Python Developer to join our growing team. This role offers the opportunity to work on various aspects of application development using Python and web technologies. Whether you're passionate about backend systems, frontend interfaces, or both, you'll find meaningful projects that match your skills and interests.

What You'll Do:

- Develop applications using Python and related frameworks.
- Develop data processing solutions leveraging the Pandas library.
- Work with data processing and analysis tools.
- Contribute to user interface development using web technologies.
- Assist with database operations and cloud integrations.
- Collaborate with team members to deliver quality software. solutions.

What We're Looking For:

- Experience with Python programming.
- Knowledge of web development fundamentals.
- Problem-solving skills and eagerness to learn.
- Ability to work effectively in a remote team environment.
- Basic understanding of databases and data structures.
- Good communication skills in English.

Nice to have:

- Familiarity with data visualization libraries or tools.
- Experience with cloud services.
- Basic knowledge of containerization concepts.
- Interest in continuous learning and skill development.

How we do make your work (and your life) easier:

- 100% remote work (from anywhere).
- Excellent compensation in USD or your local currency if preferred
- Hardware and software setup for you to work from home.
- Flexible hours: create your own schedule.
- Paid parental leaves, vacations, and national holidays.
- Innovative and multicultural work environment: collaborate and learn from the global Top 1% of talent.
- Supportive environment with mentorship, promotions, skill development, and diverse growth opportunities.

Apply now and become part of a global team where your unique talents can truly thrive!",BairesDev,https://www.linkedin.com/company/bairesdev/life,https://www.linkedin.com/jobs/view/4252704755/?eBP=CwEAAAGXnooqJoJ3V3m_UBSB8HOBCKpy1aey9zHdx4qKZ40QuDOD6oKKsTxtJe3k7FrOnNtDE_PN5yLyJgd7bUXa4sot1omTkKL_WNTimskp-hZtdPBk7S_42INpA6I9KiQGpeyAH1BhJkKeaMDoIg3rz5cWEX0W-KylYcmvIhCWjchAscIx1GzoJPCHnPuTtRkn3uggDQf7dKWo9j6EedVmrYp4zKgpUJsNU70svrZ7xkHeRLLPla2qCKGVtDC8EQ7SDdCsyj8IsPYpSBwRnsufJKje1UbvaELd70C-svauxeFbtamcpjwKUWiFtd5njYtp7FMl3MJdhMCeWJ9PXW89df0pPaZyvGKW0JX6eTsu1T_DzofqXdSVHSgyqn8PLxPyvsS7c_3eIoSiy63z3K5eo2vYvJpVksv3triVeul1EEOmuhJO5V_OsM68LNHOXYEWWYMRe-ZH&refId=6AtO7WT40SLT6rURZD8AdQ%3D%3D&trackingId=rrjjzCx2WUe96XBcKXZyAA%3D%3D&trk=flagship3_jobs_discovery_jymbii,No
"Full Stack Engineer (Java), Aladdin, Vice President","About the job
About This Role

Elevate your career by joining the world's largest asset manager. Thrive in an environment that fosters positive relationships and recognizes outstanding performance. At BlackRock, we strive to empower our employees and effectively engage your involvement in our success.

We invest and protect over $10 trillion (USD) of assets and have an extraordinary responsibility to our clients worldwide. Our technology empowers millions of investors to save for retirement, pay for college, buy a home, and improve their financial well-being.

Being a technologist at BlackRock means you get the best of both worlds: working for one of the most sophisticated financial companies and being part of a software development team responsible for next-generation technology and solutions.

What are Aladdin and Aladdin Engineering?

You will be working on internal tools built for private credit asset class and additionally you will be working on BlackRock's investment operating system called Aladdin. Aladdin is used both internally within BlackRock and externally by many financial institutions. Aladdin combines sophisticated risk analytics with comprehensive portfolio management, trading, and operations tools on a single platform to power informed decision-making and create connective tissue for thousands of users investing worldwide.

Our development teams reside inside the Aladdin Engineering group. We collaboratively build the next generation of technology that changes the way information, people, and technology intersect for global investment firms. We build and package tools that manage trillions of assets and support millions of financial instruments. We perform risk calculations and process millions of transactions for thousands of users every day worldwide!

Responsibilities

Design, code, test, and maintain reliable and robust software applications and backend services, adhering to high-quality standards and industry best practices.
Serve as a subject matter expert for the team, offering technical solutions to business requirements using top-notch technology and design principles.
Collaborate closely in a global team environment spanning several time zones.
Design and develop innovative solutions to complex problems, identifying issues and roadblocks.
Balance strong engineering results with excellent organizational, leadership, decision-making, and communication skills.
Actively participate in cross-functional feature requirements gathering, refinement, design, and implementation.
Be a leader with vision and a partner in brainstorming solutions for team productivity, efficiency, guiding and motivating others.
Ability to lead individual project priorities, deadlines, and deliverables using AGILE methodologies.
Manage software releases and support feature launches by performing post-release activities.
Drive a strong culture by bringing principles of inclusion and diversity to the team and setting the tone through specific recruiting, management actions, and employee engagement.

Qualifications

B.E./ B.TECH./ MCA or any other relevant engineering degree from a reputed university.
8+ years of proven experience.

Skills And Experience Required

9+ years of full stack software development experience building web applications and APIs using Java, TypeScript, JavaScript, Angular, and SQL.
Experience in designing, building, and deploying REST APIs.
Strong knowledge of Open-Source technology stack (Spring, Hibernate, JPA, Maven, JUnit, etc.).
Strong software design and development experience in developing distributed, multi-tier enterprise applications following industry-proven architecture and design principles.
Ability to troubleshoot and fix performance issues across the codebase and database queries.
Familiarity with Agile SDLC methodology like Scrum and Sprint-based software development, and Azure DevOps.
Great analytical, problem-solving, and communication skills, with some experience or a real interest in finance and investment processes.
Experience leading projects or being responsible for the design and technical quality of a significant application, system, or component, with the ability to form positive relationships with partnering teams, sponsors, and user groups.

Our Benefits

To help you stay energized, engaged and inspired, we offer a wide range of benefits including a strong retirement plan, tuition reimbursement, comprehensive healthcare, support for working parents and Flexible Time Off (FTO) so you can relax, recharge and be there for the people you care about.

Our hybrid work model

BlackRock’s hybrid work model is designed to enable a culture of collaboration and apprenticeship that enriches the experience of our employees, while supporting flexibility for all. Employees are currently required to work at least 4 days in the office per week, with the flexibility to work from home 1 day a week. Some business groups may require more time in the office due to their roles and responsibilities. We remain focused on increasing the impactful moments that arise when we work together in person – aligned with our commitment to performance and innovation. As a new joiner, you can count on this hybrid model to accelerate your learning and onboarding experience here at BlackRock.

About BlackRock

At BlackRock, we are all connected by one mission: to help more and more people experience financial well-being. Our clients, and the people they serve, are saving for retirement, paying for their children’s educations, buying homes and starting businesses. Their investments also help to strengthen the global economy: support businesses small and large; finance infrastructure projects that connect and power cities; and facilitate innovations that drive progress.

This mission would not be possible without our smartest investment – the one we make in our employees. It’s why we’re dedicated to creating an environment where our colleagues feel welcomed, valued and supported with networks, benefits and development opportunities to help them thrive.

For additional information on BlackRock, please visit @blackrock | Twitter: @blackrock | LinkedIn: www.linkedin.com/company/blackrock

BlackRock is proud to be an Equal Opportunity Employer. We evaluate qualified applicants without regard to age, disability, family status, gender identity, race, religion, sex, sexual orientation and other protected attributes at law.",BlackRock,https://www.linkedin.com/company/blackrock/life,https://www.linkedin.com/jobs/view/4219199627/?eBP=CwEAAAGXnoo6yUGU_sF0OC1rV1cEa03ikWXEJo4swx5F-ZlhFcNWvpoq3GvhSR_9qeMrg5ZZzSSaxLgtCS2j32-ZPUpckicjHoLio0aLrM59qHuvHffjAzdC-lLHFLzwCx8CcXZV2IdeM5iOR2KHS8k4gYtBe6QUT5gHmhveYXaXj4wTFchedObuP3msu-FHaqS6VeVR8O5GxQj5LWBvn_Mzc9ycRP28x0oCcr3rvIbaJKYm-3C06-nio7SEyiwvPE39fCBbWrl6QgYLQ-1JDFvE9x5NN3mWTocE4nUcReFXtiX7fnkv77ujN-0bd56onMYYbwmd4pLlFc3kY3CdeQMXbKEVDYoBYx9ytZ3nmQX7ZR-9JF02hsxuZSq-rcallt0FIkNFmCvXEb4hjFiyWGB8HbA80PUoR0Bw8DD7hiSLWlXMC97vGykocpKQEj8pLkmM0T2G37yT&refId=XJA2PO6f9coZctC%2F3dKjKA%3D%3D&trackingId=I6ltB49kPqAyZJvE80rdQw%3D%3D&trk=flagship3_jobs_discovery_jymbii,No
