Job Profile,Job Description,Company Name,Company Link,Job Link,Easy Apply
"Assistant Engineer, Data Modeling","About the job
Gurgaon/Bangalore, India

AXA XL recognizes data and information as critical business assets, both in terms of managing risk and enabling new business opportunities. This data should not only be high quality, but also actionable - enabling AXA XL’s executive leadership team to maximize benefits and facilitate sustained industrious advantage. Our Chief Data Office also known as our Innovation, Data Intelligence & Analytics team (IDA) is focused on driving innovation through optimizing how we leverage data to drive strategy and create a new business model - disrupting the insurance market. As we develop an enterprise-wide data and digital strategy that moves us toward greater focus on the use of data and data-driven insights, we are seeking an Assistant Scientist for our Data Engineering team. The role will support the team’s efforts towards creating, enhancing, and stabilizing the Enterprise data lake through the development of the data pipelines. This role requires a person who is a team player and can work well with team members from other disciplines to deliver data in an efficient and strategic manner.

What You’ll Be DOING

What will your essential responsibilities include?

Collaborate with cross-functional teams to understand data requirements and business needs.
Utilize SQL to query and manipulate data from various sources, ensuring data accuracy and integrity.
Develop and maintain data pipelines using DBT, Databricks to facilitate data processing and transformation.
Assist in deploying and managing data solutions on Azure Cloud, ensuring optimal performance and security.
Create and maintain documentation for data processes, data models, and system architecture.
Participate in data quality checks and troubleshooting to resolve data-related issues.
Maintain integrity and quality across all pipelines and environments.
Understand and follow secure coding practices to make sure the code is not vulnerable.
Bring ideas to the tables that help to streamline and rationalize BTL jobs.
Leads small team strategic partner/vendor team members.
Works with business users and tries to bring closure to the request.

You will report to the Division Lead of Data Modeling.

What You Will BRING

We’re looking for someone who has these abilities and skills:

Required Skills And Abilities

Bachelor’s degree in computer science, Mathematics, Statistics, Finance, related technical field, or equivalent work experience.
Proficiency in SQL for database querying and management.
Excellent programming skills in Python, with experience in data manipulation and analysis.
Must have hands-on experience in designing and developing ETL Pipelines.
Relevant years of exposure and good proficiency in data warehousing concepts.
Proficient in SQL and database Design concepts.
Good knowledge of unit testing, documentation - low-level design.

Desired Skills And Abilities

Knowledge of the DBT/Databricks is a plus.
Knowledge of Git is a plus.
Knowledge of Azure cloud computing platform with Azure Synapse, and ADLS is a plus.
Knowledge of Databricks and ADF, Pyspark is a plus.
Passion for data and experience working within a data-driven organization.
You care about what you do, and what we do.
Knowledge of GitHub and build management.

Who WE are

AXA XL, the P&C and specialty risk division of AXA, is known for solving complex risks. For mid-sized companies, multinationals and even some inspirational individuals we don’t just provide re/insurance, we reinvent it.

How? By combining a comprehensive and efficient capital platform, data-driven insights, leading technology, and the best talent in an agile and inclusive workspace, empowered to deliver top client service across all our lines of business − property, casualty, professional, financial lines and specialty.

With an innovative and flexible approach to risk solutions, we partner with those who move the world forward.

Learn more at axaxl.com

What we OFFER

Inclusion

AXA XL is committed to equal employment opportunity and will consider applicants regardless of gender, sexual orientation, age, ethnicity and origins, marital status, religion, disability, or any other protected characteristic. At AXA XL, we know that an inclusive culture and enables business growth and is critical to our success. That’s why we have made a strategic commitment to attract, develop, advance and retain the most inclusive workforce possible, and create a culture where everyone can bring their full selves to work and reach their highest potential. It’s about helping one another — and our business — to move forward and succeed.

Five Business Resource Groups focused on gender, LGBTQ+, ethnicity and origins, disability and inclusion with 20 Chapters around the globe.
Robust support for Flexible Working Arrangements
Enhanced family-friendly leave benefits
Named to the Diversity Best Practices Index
Signatory to the UK Women in Finance Charter

Learn more at axaxl.com/about-us/inclusion-and-diversity. AXA XL is an Equal Opportunity Employer.

Total Rewards

AXA XL’s Reward program is designed to take care of what matters most to you, covering the full picture of your health, wellbeing, lifestyle and financial security. It provides competitive compensation and personalized, inclusive benefits that evolve as you do.

We’re committed to rewarding your contribution for the long term, so you can be your best self today and look forward to the future with confidence.

Sustainability

At AXA XL, Sustainability is integral to our business strategy. In an ever-changing world, AXA XL protects what matters most for our clients and communities. We know that sustainability is at the root of a more resilient future. Our 2023-26 Sustainability strategy, called “Roots of resilience”, focuses on protecting natural ecosystems, addressing climate change, and embedding sustainable practices across our operations.

Our Pillars

Valuing nature: How we impact nature affects how nature impacts us. Resilient ecosystems - the foundation of a sustainable planet and society - are essential to our future. We’re committed to protecting and restoring nature - from mangrove forests to the bees in our backyard - by increasing biodiversity awareness and inspiring clients and colleagues to put nature at the heart of their plans.
Addressing climate change: The effects of a changing climate are far-reaching and significant. Unpredictable weather, increasing temperatures, and rising sea levels cause both social inequalities and environmental disruption. We're building a net zero strategy, developing insurance products and services, and mobilizing to advance thought leadership and investment in societal-led solutions.
Integrating ESG: All companies have a role to play in building a more resilient future. Incorporating ESG considerations into our internal processes and practices builds resilience from the roots of our business. We’re training our colleagues, engaging our external partners, and evolving our sustainability governance and reporting.
AXA Hearts in Action: We have established volunteering and charitable giving programs to help colleagues support causes that matter most to them, known as AXA XL’s “Hearts in Action” programs. These include our Matching Gifts program, Volunteering Leave, and our annual volunteering day - the Global Day of Giving.

For more information, please see axaxl.com/sustainability.",AXA XL,https://www.linkedin.com/company/axaxl/life,https://www.linkedin.com/jobs/view/4245505048/?eBP=NOT_ELIGIBLE_FOR_CHARGING&refId=6AtO7WT40SLT6rURZD8AdQ%3D%3D&trackingId=Gj9RRTzfKx%2BQ7FUwu3%2Bu9w%3D%3D&trk=flagship3_jobs_discovery_jymbii,No
Senior Clinical Software Engineer,"About the job
Mid-level position responsible for development, infrastructure and support of systems and tools that help maximize efficiency and effectiveness of executing St. Jude Medical Clinical Trials globally. Assignments may include but are not limited to designing and developing clinical trial databases, developing and supporting technology solutions for clinical trial management, designing data models, conducting code reviews, and maintaining and supporting clinical systems infrastructure.

Job Duties: List the significant/essential duties, tasks or responsibilities which employees in this position are required to perform.

Develops complex software solutions to streamline management and execution of clinical trials using technologies such as ASP.NET, PL/SQL, BI Dashboard and BI Publisher via Software Development Life Cycle (SDLC) best practices
Develops Software Requirements and Design Specifications
Builds and supports clinical study databases using Oracle Clinical Database Management System based on requirements provided by Clinical Data Analysts utilizing development standards
Develops error validation functionality to improve user experience and to ensure the integrity of clinical study databases
Develops custom utilities to streamline Oracle Clinical interfaces to various clinical and non-clinical systems using Oracle PL/SQL and ASP.NET
Maintains and supports existing applications through development and architecture of new features and enhancements
Maintains and administers security and access control for the SJM Global Clinical Affairs Organization
Develops solutions to streamline software configuration/release management to improve software quality and performance
Maintains and supports infrastructure for all systems and tools supported by Clinical Data Systems, including software installation, configuration and deployment
Works independently with minimal guidance required
May lead establishment and improvement of software development standards and practices
May mentor other team members on development approaches and new technologies
May lead architecture and design on larger, more complex projects
May supervise other team members or lead projects
May assist leadership with project prioritization and development of clinical technology strategy
Support all Company initiatives as identified by management and in support of Quality Management Systems (QMS), Environmental Management Systems (EMS), and other regulatory requirements.
Complies with U.S. Food and Drug Administration (FDA) regulations, other regulatory requirements, Company policies, operating procedures, processes, and task assignments
Maintains positive and cooperative communications and collaboration with all levels of employees, customers, contractors, and vendors
Performs other related duties and responsibilities, on occasion, as assigned.

Qualifications: Describe the minimum education and experience, including knowledge, skills and abilities, required to successfully perform the job. List any certificates, license, and/or registrations required. 

General Qualifications

Bachelor Degree in Software Engineering, Computer Science, or equivalent
6-8 years of development experience with ASP.NET
6-8 years of database modeling/design experience using SQL 
6-8 years of software infrastructure support, including software configuration and release management
1-3 years of leading software architecture and design experience
Experience with Software Development Lifecycle (SDLC) phases and Rapid Development Frameworks
Experience with software development design patterns and methodologies including OOAD and MVC
Experience with HTML5 and JavaScript Libraries such as Knockout, Angular and Kendo UI preferred
Experience with Mobile Application Development frameworks such as xCode, Android NDK, Xamarin and PhoneGap preferred
A working familiarity with Microsoft office products including Word, Excel, and Access
Experience with Unix/Linux (*NIX) platforms
Basic Windows Desktop Administration experience such as application installation and troubleshooting
Windows Server Administration experience including installation of server roles, log management and troubleshooting
Knowledge of Windows Server Security practices in an enterprise environment including computer network authenticating protocols such as Kerberos
Experience working with active directory in either a development or administrative environment
Experience integrating software with enterprise level systems
Experience mentoring and teaching other team members
Experience building clinical trial databases using Oracle Clinical or equivalent preferred
Experience building/customizing Clinical Trial Management Applications preferred
Basic understanding of Clinical Trial Management Process preferred
Basic understanding of human physiology or any prior involvement with medical field preferred
Experience working in a broader enterprise/cross-division business unit model preferred
Ability to work in a highly matrixed and geographically diverse business environment
Ability to work within a team and as an individual contributor in a fast-paced, changing environment
Ability to leverage and/or engage others to accomplish projects
Strong verbal and written communications with ability to effectively communicate at multiple levels in the organization
Multitasks, prioritizes and meets deadlines in timely manner
Strong organizational and follow-up skills, as well as attention to detail
Ability to travel up to 5%",Abbott,https://www.linkedin.com/company/abbott-/life,https://www.linkedin.com/jobs/view/4251066043/?eBP=CwEAAAGXnon8anALWoajWkDPmpehz-O0JMrEmh8-XrHZU11ZrgbCkkg3_VgY-gbMrg4gFXfF4kv6ViQtyqV3n1slfClN4opSyXj6nRarLkaj65HZqwAXc5vKxF2iGZ7LpCKvYZXO_QI0gPIS16bPehXHQktOp0GYYLF0Zuos6haH5Iht44S8-TI_IA5LrK1ycTcW-UZGipoMLvankuqNomG5mdQTFb9Zp7_AhWw6lmN1nIBGhEjb5FOEr1G9QWQeSpRsUAIpG3gA3rFwJueWI7g5CaA21D7YQxUmYv9osCS9DURrmZhCsxryrcZdTagZ9giKgXjw9-GqNvhLmKrCYiErulk4S84RusVwSaNidVDp1P07nWiGsKEs2HnsZWyYhqanYgY7FAcDQL5wJZTb-N-rzDDBhBLD1hI302XV4r6DnJrKl3z1vh1bohpqL1jQx4jO41zwhcHj&refId=TDn6WGgkyp79raMhcg9hJg%3D%3D&trackingId=NTJID2i1hHWtZOiqw7WOnA%3D%3D&trk=flagship3_jobs_discovery_jymbii,No
Software Development Engineer 3,"About the job
Job Description

Publicis Sapient is looking for a Software Development Engineers (SDE-III) to join our team of bright thinkers and doers. Software Development Engineers (SDE-III) are bright, talented and motivated young minds with strong technical skills, developing software applications and services that make life easier for customers. The SDE-III is expected to work with multiple agile teams in one or more client accounts to develop, test, and maintain digital business applications. As an SDE-III you will get an opportunity to work with industry leading clients and global teams to solve complex business problems and build your skills on the full stack of application development technologies

Your Impact

You will work in the spirit of agile & a product engineering mindset - driving the sprint outcomes, iteratively & incrementally, following the agile ceremonies
You will help define & prioritize Epics and Business Roadmap; Govern the Epics functionally & address both Functional & Non-Functional/NFRs collaborating actively with stakeholders - locally & in client org., shaping end-to-end customer requirements
You will govern the technical grooming, brainstorming & whiteboarding design sessions to define & articulate the solution approaches, to identify tasks & estimates, to design and document E2E system(s) along with interfaces, contracts & wireframes
You will have breadth of concepts, tools & technologies to address NFRs like security, performance, reliability, maintainability and advocate relevant trade-offs
You will bring in expertise to optimize and make the relevant design decisions (considering trade-offs) at the E2E system(s) level & challenge the status-quo
You will be a polyglot with a PE mindset – Open & Curious, learning & adopting new languages, platforms & toolkits constantly
You will work with HoE’s to define & understand the overall system architecture, standards & guidelines, helping with the details of the E2E system(s) landscape
You will mentor & guide, actively evangelize and inculcate the engineering mindset and culture, share knowledge within Peer groups, SDE-IIs, while providing and receiving constructive feedback
You will drive change with a continuous improvement mindset working on opportunities to shift left; Proactive about reduction of tech. debts, eliminating waste, increasing automation, using the right productivity tools, understanding client business, using dashboards for monitoring & alerts
You will be accountable for E2E system design, Governance, Evangelization, Advocacy, Quality with an E2E focus, establishing engineering best practices, standards:
Solve problems at a Roadmap level, driving and influencing the overall business requirements
Design & Integrate Systems focused on solving business problems; Ensure Implementations are well integrated with all other parts of the enterprise.
Evangelize adoption of Test First approach & TDD; Apply BDD for Functional & Integration testing; Govern Engg. Metrics focus & adoption within all teams in an account.
Govern elimination of Tech. Debts
Govern Engineering Maturing Model Adoption, within cross cultural teams spread across Geo’s
Perform Reviews of E2E system integration & Architectural validation
Identify & adopt new and relevant tools, practices, platforms taking the technology & solution focus to the next level in the spirit of Continuous Improvement
Practice & Inculcate the PE & DevOps mindset, with automation as core-focus
Devise Training strategies; Evaluate and Appraise technical talent within team
Work with other departments in the organization like Recruitment, Hiring, People Success to Identify, Nurture & Recognize talent

Qualifications

Your Skills & Experience:

You have 13+ years of professional work experience building large scale, large volume services & distributed apps., taking them through production and post-production life cycles
Strong expertise in Gen AI/ML space.
You Identify & create POC’s on new business segments, technologies; building quick and usable solutions
You use more than one programming language with deep expertise in language features, concepts and protocols; Ex:
Memory Management, GC, Templates/Generics, Closures etc.
Multi-Threading, Sync/A-Sync.; Blocking/Non-Blocking execution styles
Lambdas, Streams, Performance Tuning, NIO, HTTP2, Websockets, gRPC, ProtoBuf
You practice Imperative, Functional Programming styles
You use Cloud Platforms like AWS, GCP, Azure etc.
You practice distributed, cloud design patterns & architectural styles
You use API gateways and Management Tools, load-balancers, CDNs, Edge caching, reverse proxies
You use search solutions like Elastic Search, SOLR, Endeca
You use performance testing tools like JMeter, Gatling
You use distributed tracing apps/platforms, debug and troubleshoot with relevant tools
You use distributed caching solutions like Redis, Memcache etc.
You use side-cars, service mesh along with microservices
You practice reactive programming, observables (e.g. Spring Reactor/RX Java), Actor models, Akka, Play etc.
You use GraphQL, Aggregate services, API Composition, SAGA pattern
You use K8S, Container Orchestration, Mesos, Consensus algorithms like PAXOS
You are a problem solver - choosing the relevant data structures, algorithms considering the tools for Time & Space Complexity
You Govern & Steer relevant technology & tools selection, build/buy decisions to solve the business problems
You are an expert at reviewing & guiding the adoption of SOLID, DRY design principles, design patterns & Clean Code
You are an expert at String Manipulation, Data/Time Arithmetic, Collections & Generics
You practice & guide on handling failures à Error Management & Exception handling
You build reliable, scalable & high-performance apps, services leveraging relevant architectural styles and patterns like Eventing Sourcing, CEP, Restful APIs, CQRS etc.
You develop web apps using HTML, CSS, Java-script & relevant frameworks (Angular, React, Vue)
You design and build microservices from grounds up applying DDD, Bounded Contexts; Considering multiple perspectives and tradeoffs to meet the NFRs
You define real-time solutions to scale up/scale out/Auto Scale as relevant, with robustness and resilience, applying patterns like circuit breakers & back propagation
You understand CAP theorem and work with multiple databases (RDBMS or NoSQL)
You deploy to production, trouble shoot problems & provide live support
You practice and ensure coverage of security aspects & compliance to data, code & application security policies; You write secure code to prevent known vulnerabilities; You understand HTTPS/TLS, Symmetric/Asymmetric Cryptography, Certificates, SAML, Vaults, Key rotation, OAuth, JWT, MFA, DDOS etc.
You are an expert & advocate the use of the relevant Web Application Frameworks
Spring or Spring Boot or Micronaut (Java)
Flask or Django (Python)
Express or Meteor or Koa (Node)
Asp.net MVC, WebApi or Nancy (.Net)
You use one or more messaging platforms (e.g. JMS/RabbitMQ/Kafka/Tibco/Camel)
You use Mocks & Stubs & related frameworks (Moq)
You use logging frameworks like Log4j, NLog etc.
You use build tools like MsBuild, Maven, Gradle, Gulp etc.
You understand and use containers, virtualization
You use proactive monitoring & alerting, dashboards
You use Logging/Monitoring solutions (Splunk, ELK, Grafana)
You practice & ensure infra. as code (cattle over pets) using tools like terraform, cloud-formation, ansible etc.
You set-up a CI/CD pipeline infrastructure & stack from grounds-up
You articulate the pro’s, con’s of designs; along with tradeoffs influencing key stakeholders
You use gherkin and cucumber for BDD automation
You use selenium for UI automation
You use rules engines like Drools, Easy Rules etc.
Growth Culture

Learning is part of our DNA. We always support exploratory behavior to help you deliver innovative solutions, staying ahead in the curve. You also get opportunity to share your knowledge across the organization through technical sessions and active contribution to various engineering groups.

Education

Bachelor’s/Master’s Degree in Computer Engineering, Computer Science, or a related field

Additional Information

Gender-Neutral Policy
18 paid holidays throughout the year.
Generous parental leave and new parent transition program
Flexible work arrangements
Employee Assistance Programs to help you in wellness and well being

Company Description

Publicis Sapient is a digital transformation partner helping established organizations get to their future, digitally enabled state, both in the way they work and the way they serve their customers. We help unlock value through a start-up mindset and modern methods, fusing strategy, consulting and customer experience with agile engineering and problem-solving creativity. United by our core values and our purpose of helping people thrive in the brave pursuit of next, our 20,000+ people in 53 offices around the world combine experience across technology, data sciences, consulting and customer obsession to accelerate our clients’ businesses through designing the products and services their customers truly value.",Publicis Sapient,https://www.linkedin.com/company/publicissapient/life,https://www.linkedin.com/jobs/view/4206053285/?eBP=CwEAAAGXnoo6yWIkPNGAnpTDmiuVNHOGRgCBQ9jjBel2loTWAzZ5MI2MRKYT6OciXDeljO7WKNnKiYl57aKiM4g16wnZ85ql0VZ1cWkF3c6yeMObvak8gWkqcfI3F1Q0EIH_DXFLfxjKf0zilBXHor2zzvKKq0K2la4oPmwf7gix__zDFmcaViJz_NSvuoLvW4NDRf9F-cZpQIM70Wqqg5uBRPzRdC4kxylq1kIS15Z3rS4Pqt66c7geTmNDHF2e3A3-dD3BsmwVuDFydOQKjYrr4fgzoRGow2s8JqALDXTFrq-aWDhRDqpoSmuVS4vZjbd0jGcsEqDYJ8QEGjTXco94qeClji6BauvOVdKFo6kEhAM0A98JOaQhw_i7j-Qr3AUGz1MEiuozlBIfHqQAtMJ4zq3fO6_sobzc0oKy22v-eBEKqJSrhO_s6BBTzHhIIIJq69gLH5JPRfw&refId=XJA2PO6f9coZctC%2F3dKjKA%3D%3D&trackingId=ULp75WS59KW%2FI22WTJYHwA%3D%3D&trk=flagship3_jobs_discovery_jymbii,No
